{
  "title": "The Vanishing Meridian",
  "firstCheckpoint": {
    "name": "North Marker",
    "latitude": 37.76942,
    "longitude": -122.48621,
    "radiusMeters": 45,
    "maximumAccuracyMeters": 40
  },
  "puzzle": {
    "prompt": "I have cities but no houses, forests but no trees, and water but no fish. What am I?",
    "answer": "map"
  },
  "secondCheckpoint": {
    "name": "South Marker",
    "latitude": 37.76815,
    "longitude": -122.48372,
    "radiusMeters": 45,
    "maximumAccuracyMeters": 40
  },
  "maximumObservationAgeMs": 15000
}
